{
  "schema_version": 2,
  "iteration": 137,
  "agent": "collapsible-sections-agent-137",
  "size": "S",
  "goal": "Die in I136 eingeführten semantischen Vorschau-Abschnitte browserlokal einklappbar machen. Der Zustand bleibt flüchtig, separat vom Draft-Datenobjekt und ohne Persistenz.",
  "change_kind": "ui",
  "gate_profile": "ui",
  "guide_delta": {
    "mode": "explain_change",
    "topic": "Einklappbare Gruppen",
    "summary": "Bereich-Überschriften erhalten einen zugänglichen Ein-/Ausklapp-Toggle mit aria-expanded und aria-controls. Der Zustand lebt ausschließlich in einem flüchtigen Browser-Set.",
    "target_doc": "README.md"
  },
  "write_files": [
    ".provoware/iterations/0137-collapsible-sections.json",
    "src/provoware_db/mask_builder/browser_shell.py",
    "tests/mask_builder/test_i137_collapsible_sections.py",
    "README.md",
    "TODO.md"
  ],
  "read_files": [
    "AGENTS.md",
    "README.md",
    "TODO.md",
    "src/provoware_db/mask_builder/browser_shell.py",
    "tests/mask_builder/test_i136_sections.py"
  ],
  "direct_dependencies": [
    "main 2f62b353e7e8883904de8698b9e4da91b62320a8",
    "I136 semantic preview sections are confirmed",
    "I135 order remains the sole source of section membership",
    "I129 persistence boundary remains plan-only and closed",
    "CP-03 and CP-06 remain frozen"
  ],
  "tests_required": [
    "compile browser_shell.py and test_i137_collapsible_sections.py",
    "run test_i137_collapsible_sections.py",
    "run existing test_browser_shell.py as narrow browser-shell regression",
    "toggle exposes aria-expanded and aria-controls",
    "collapsed content uses the native hidden state",
    "focus returns to the same section toggle after rerender",
    "removed sections release stale collapse state",
    "collapse state remains outside the draft element object",
    "no persistence/network/store path"
  ],
  "tests_explicitly_not_run": [
    "database/repository tests because no persistence path changes",
    "Control Plane tests because governance is unchanged",
    "full product suite because the change is browser-local and targeted",
    "new Chromium screenshot evidence because this is not the scheduled visual milestone"
  ],
  "pip_requirements": [],
  "ci": {
    "compile": [
      "src/provoware_db/mask_builder/browser_shell.py",
      "tests/mask_builder/test_i137_collapsible_sections.py"
    ],
    "python_tests": [
      "tests/mask_builder/test_browser_shell.py",
      "tests/mask_builder/test_i137_collapsible_sections.py"
    ]
  },
  "risks": [
    "collapse state must not leak into future persistence accidentally",
    "focus must not be lost after rerender",
    "aria-expanded must reflect the visible state of the controlled list",
    "removing a section must not leave stale collapse state"
  ],
  "non_changes": [
    "no MaskTemplate/MaskFieldSpec/MaskTemplateStore changes",
    "no JSON schema or SQLite changes",
    "no HTTP write route or browser storage",
    "no CP-03 or CP-06 reopen",
    "no dependencies",
    "no persisted group state"
  ],
  "expected_side_effects": [
    "visible sections can be collapsed and expanded directly in preview",
    "the section heading remains the accessible toggle label",
    "collapsed state survives ordinary browser rerenders but not page reload",
    "A-M progress becomes 24 of 132 = 18.2 percent"
  ],
  "screenshot_required": false,
  "status": "IMPLEMENTED_PENDING_GATE"
}
